id,subreddit,title,posttext,time_posted,time_now,time_difference,num_comments,upvote_ratio,url
18888ww,stocks,Rate My Portfolio - r/Stocks Quarterly Thread December 2023,"Please use this thread to discuss your portfolio, learn of other stock tickers, and help out users by giving constructive criticism.

Why quarterly?  Public companies report earnings quarterly; many investors take this as an opportunity to rebalance their portfolios.  We highly recommend you do some reading:  A list of [relevant posts & book recommendations.](https://www.reddit.com/r/stocks/wiki/index#wiki_relevant_posts_.26amp.3B_book_recommendations)

You can find stocks on your own by using a scanner like your broker's or [Finviz.](https://finviz.com/screener.ashx)  To help further, here's a list of [relevant websites.](https://www.reddit.com/r/stocks/wiki/index#wiki_relevant_websites.2Fapps)

If you don't have a broker yet, see our [list of brokers](https://www.reddit.com/r/stocks/wiki/index#wiki_brokers_for_investing) or search old posts.  If you haven't started investing or trading yet, then setup your [paper trading.](https://www.reddit.com/r/stocks/wiki/index#wiki_is_there_a_way_to_practice.3F)

Be aware of [Business Cycle Investing](https://eresearch.fidelity.com/eresearch/markets_sectors/sectors/si_business_cycle.jhtml?tab=sibusiness) which Fidelity issues updates to the state of global business cycles every 1 to 3 months (note: Fidelity changes their links often, so search for it since their take on it is enlightening).  [Investopedia's take on the Business Cycle](https://www.investopedia.com/articles/investing/061316/business-cycle-investing-ratios-use-each-cycle.asp) and their [video.](https://www.investopedia.com/video/play/business-cycle/)

If you need help with a falling stock price, check out Investopedia's [The Art of Selling A Losing Position](https://www.investopedia.com/articles/02/022002.asp) and their [list of biases.](https://www.investopedia.com/articles/stocks/08/capital-losses.asp)

Here's a list of all the [previous portfolio stickies.](https://www.reddit.com/r/stocks/search?q=author%3Aautomoderator+title%3A%22Rate+My+Portfolio%22&restrict_sr=on&sort=new&t=all)",2023-12-01 10:00:24,2024-02-29 15:30:27.699925,90 days 05:30:03.699926,621,0.99,https://www.reddit.com/r/stocks/comments/18888ww/rate_my_portfolio_rstocks_quarterly_thread/
1b2x8gt,stocks,"r/Stocks Daily Discussion & Options Trading Thursday - Feb 29, 2024","This is the daily discussion, so anything stocks related is fine, but the theme for today is on stock options, but if options aren't your thing then just ignore the theme.

Some helpful day to day links, including news:

* [Finviz](https://finviz.com/quote.ashx?t=spy) for charts, fundamentals, and aggregated news on individual stocks
* [Bloomberg market news](https://www.bloomberg.com/markets)
* StreetInsider news:
  * [Market Check](https://www.streetinsider.com/Market+Check) - Possibly why the market is doing what it's doing including sudden spikes/dips
  * [Reuters aggregated](https://www.streetinsider.com/Reuters) - Global news

-----

Required info to start understanding options:

* [Call option Investopedia video](https://www.investopedia.com/terms/c/calloption.asp) basically a call option allows you to buy 100 shares of a stock at a certain price (strike price), but without the obligation to buy
* [Put option Investopedia video](https://www.investopedia.com/terms/p/putoption.asp) a put option allows you to sell 100 shares of a stock at a certain price (strike price), but without the obligation to sell
* Writing options switches the obligation to you and you'll be forced to buy someone else's shares (writing puts) or sell your shares (writing calls)

See the following word cloud and click through for the wiki:

[Call option - Put option - Exercising an option - Strike price - ITM - OTM - ATM - Long options - Short options - Combo - Debit - Credit or Premium - Covered call - Naked - Debit call spread - Credit call spread - Strangle - Iron condor - Vertical debit spreads - Iron Fly](https://www.reddit.com/r/stocks/wiki/options-themed-post)

If you have a basic question, for example ""what is delta,"" then google ""investopedia delta"" and click the investopedia article on it; do this for everything until you have a more in depth question or just want to share what you learned.

See our past [daily discussions here.](https://www.reddit.com/r/stocks/search?q=author%3Aautomoderator+%22r%2Fstocks+daily+discussion%22&restrict_sr=on&sort=new&t=all)  Also links for:  [Technicals](https://www.reddit.com/r/stocks/search?q=author%3Aautomoderator+title%3Atechnicals&restrict_sr=on&include_over_18=on&sort=new&t=all) Tuesday, [Options Trading](https://www.reddit.com/r/stocks/search?q=author%3Aautomoderator+title%3Aoptions&restrict_sr=on&include_over_18=on&sort=new&t=all) Thursday, and [Fundamentals](https://www.reddit.com/r/stocks/search?q=author%3Aautomoderator+title%3Afundamentals&restrict_sr=on&include_over_18=on&sort=new&t=all) Friday.",2024-02-29 10:30:08,2024-02-29 15:30:27.699933,0 days 05:00:19.699933,97,0.9,https://www.reddit.com/r/stocks/comments/1b2x8gt/rstocks_daily_discussion_options_trading_thursday/
1b2hsi4,stocks,Snowflake says Frank Slootman is retiring as CEO; stock plunges 20%,"Snowflake said Wednesday that CEO Frank Slootman is retiring, and will be replaced by Google ad chief Sridhar Ramaswamy. The shares plunged 20% in extended trading.

Ramaswamy spent 15 years at Google, most recently leading Ads and Commerce until 2018. He then left to co-found Neeva in 2019, a consumer search engine he hoped to rival Google until last year, when he announced he was shutting it down. 

Snowflake acquired Neeva in June for an undisclosed price.

Source: https://www.cnbc.com/2024/02/28/snowflake-says-frank-slootman-is-retiring-as-ceo-stock-plunges-20percent.html",2024-02-28 21:19:46,2024-02-29 15:30:27.699938,0 days 18:10:41.699938,174,0.95,https://www.reddit.com/r/stocks/comments/1b2hsi4/snowflake_says_frank_slootman_is_retiring_as_ceo/
1b2knaw,stocks,"EA to lay off 5% of workforce, or about 670 employees","Electronic Arts
 announced Wednesday that it will cut 5% of its workforce, part of a plan that includes reducing office space and ending work on some video games.

EA employed 13,400 workers as of the end of March 2023, according to its most recent annual filing with the U.S. Securities and Exchange Commission in May. That means the layoffs may affect about 670 jobs.

The company’s announcement marks the latest headcount reduction among video game developers in recent months, continuing a broader trend of significant downsizing across the tech industry. 

On Tuesday, Sony said it would lay off about 900 employees in its PlayStation division, or 8% of its workforce. Last month, Microsoft cut 1,900 jobs across its gaming unit three months after it acquired Activision Blizzard, and Tencent’s Riot Games slashed 11% of its workforce.

EA CEO Andrew Wilson wrote in a memo to employees on Wednesday that the video game company is “streamlining our company operations to deliver deeper, more connected experiences for fans everywhere.”

The cuts will support EA’s “strategic priorities and growth initiatives,” according to a Wednesday filing with the SEC. The company expects its restructuring plan will be “substantially complete” by the end of December.

“We are continuing to optimize our global real estate footprint to best support our business,” Wilson wrote in his Wednesday note. “We are also sunsetting games and moving away from development of future licensed IP that we do not believe will be successful in our changing industry.”

Wilson added that the cuts will enable EA to focus more on its “biggest opportunities — including our owned IP, sports, and massive online communities.” 

During the company’s third-quarter earnings call last month, Wilson said the company would focus on continuing to invest in its existing gaming franchises attracting large online audiences, including Apex Legends, Battlefield, EA Sports FC, Madden NFL and The Sims.

Source: https://www.cnbc.com/2024/02/28/ea-layoffs-company-to-cut-5percent-of-workforce-or-about-670-employees.html",2024-02-28 23:10:53,2024-02-29 15:30:27.699942,0 days 16:19:34.699942,93,0.96,https://www.reddit.com/r/stocks/comments/1b2knaw/ea_to_lay_off_5_of_workforce_or_about_670/
1b31nk9,stocks,"Key Fed inflation measure rose 0.4% in January as expected, up 2.8% from a year ago","[https://www.cnbc.com/2024/02/29/pce-inflation-january-2023-.html](https://www.cnbc.com/2024/02/29/pce-inflation-january-2023-.html)

Inflation rose in line with expectations in January, according to an important gauge the Federal Reserve uses as it deliberates cutting interest rates.  
  
The personal consumption expenditures price index excluding food and energy costs increased 0.4% for the month and 2.8% from a year ago, as expected according to the Dow Jones consensus estimates.  
  
Headline PCE, including the volatile food and energy categories, increased 0.3% monthly and 2.4% on a 12-month basis, compared with respective estimates for 0.3% and 2.4%, according to the numbers released Thursday by the Commerce Department’s Bureau of Economic Analysis.  
  
The moves came amid an unexpected jump in personal income, which rose 1%, well above the forecast for 0.3%. Spending decreased 0.1% versus the estimate for a 0.2% gain.  
  
January’s price rises reflected an ongoing shift to services over goods as the economy normalizes from the Covid pandemic disruptions.  
  
Services prices increased 0.6% on the month while goods fell 0.2%; on a 12-month basis, services rose 3.9% and goods were down 0.5%. Within those categories, food prices accelerated 0.5%, offset by a 1.4% slide in energy. On a year-over-year basis, food was up 1.4% while energy fell 4.9%.  
  
Both the headline and core measures remain ahead of the Fed’s goal for 2% annual inflation. While the Fed officially uses the headline measure, policymakers tend to pay more attention to core as a better indication of where long-term trends are heading.  
  
Wall Street reacted little to the news, with stock market futures up slightly and Treasury yields slightly higher. Futures markets where traders bet on the direction of interest rates also indicated little movement, with pricing tilted toward the Fed’s first rate cut coming in June.  
  
“Overall, \[the report\] is meeting the expectations, and some of the worst fears in the market weren’t met,” said Stephen Gallagher, chief U.S. economist at Société Générale. “The key is we’re not seeing the broad nature of increases that we had been more fearful of.”  
  
Thursday’s BEA report also showed that consumers are continuing to dip into savings as prices stay elevated. The personal savings rate was 3.8% on the month, slightly higher than December but off a full percentage point from where it was as recently as June 2023.  
  
In other economic news, a Labor Department report showed that companies are still reluctant to lay off workers.  
  
Initial jobless claims totaled 215,000 for the week ended Feb. 24, up 13,000 from the previous period and more than the 210,000 Dow Jones estimate but still largely in keeping with recent trends. However, continuing claims, which run a week behind, rose to just above 1.9 million, a gain of 45,000 and higher than the FactSet estimate for 1.88 million.  
  
The reports come as central bank officials mull the future of monetary policy following 11 interest rate increases totaling 5.25 percentage points. Running from March 2022 to July 2023, the hikes came as the Fed battled inflation that peaked at a more than 40-year high in mid-2022.  
  
Officials have said in recent days that they expect to begin reversing the increases at some point this year. However, the timing and extent of the policy easing is uncertain as recent data has indicated that inflation could be more stubborn than expected.  
  
January’s consumer price index data raised fears of persistently high inflation, though many economists saw the rise as impacted by seasonal factors and shelter increases unlikely to persist.  
  
While the CPI is used as an input to the PCE, Fed officials focus more on the latter as it adjusts for substitutions consumers make for goods and services as prices fall. Where the CPI is viewed as a simpler price measure, the PCE is viewed as more representative of what people are actually buying",2024-02-29 14:30:37,2024-02-29 15:30:27.699947,0 days 00:59:50.699947,29,0.92,https://www.reddit.com/r/stocks/comments/1b31nk9/key_fed_inflation_measure_rose_04_in_january_as/
1b2l2vl,stocks,"Duolingo’s stock soars more than 20% after ‘record’ bookings, quarterly profit for company","Shares of Duolingo Inc. jumped more than 20% in the extended session Wednesday after the learning company said that a “record” fourth quarter capped an “exceptional” year thanks to more bookings, revenue and profitability.  
Duolingo DUOL said that its daily active users rose 65% year on year to nearly 27 million people, and monthly active users rose 46% year on year to about 88 million. The company also guided for better-than-expected revenue for the current quarter and for 2024.

[https://www.marketwatch.com/story/duolingos-stock-soars-more-than-20-after-record-bookings-quarterly-profit-93dab817](https://www.marketwatch.com/story/duolingos-stock-soars-more-than-20-after-record-bookings-quarterly-profit-93dab817)",2024-02-28 23:28:12,2024-02-29 15:30:27.699951,0 days 16:02:15.699951,43,0.96,https://www.reddit.com/r/stocks/comments/1b2l2vl/duolingos_stock_soars_more_than_20_after_record/
1b2dv7t,stocks,"Google hit with $2.3 bln lawsuit by Axel Springer, other media groups","https://www.reuters.com/technology/google-hit-with-23-bln-lawsuit-by-axel-springer-other-media-groups-2024-02-28/

>The move by the group - which include publishers in Austria, Belgium, Bulgaria, the Czech Republic, Denmark, Finland, Hungary, Luxembourg, the Netherlands, Norway, Poland, Spain and Sweden - comes as antitrust regulators also crack down on Google's ad tech business.


Gemini and now this.

I wonder to what extent this could hurt their ads revenues in the long term... Seems more serious than the Gemini stuff.

",2024-02-28 18:47:25,2024-02-29 15:30:27.699955,0 days 20:43:02.699955,111,0.94,https://www.reddit.com/r/stocks/comments/1b2dv7t/google_hit_with_23_bln_lawsuit_by_axel_springer/
1b2hr1z,stocks,Salesforce follows Meta..announces dividend!,"Salesforce ($CRM) initiates a Quarterly Dividend of $0.40 per share (~ 0.53% yield)

Also announced share repurchase Program Authorization Increased by $10 Billion

Link: https://www.businesswire.com/news/home/20240228722646/en/Salesforce-Announces-Strong-Fourth-Quarter-Fiscal-2024-Results#:~:text=Salesforce's%20Board%20of%20Directors%20declared,business%20on%20March%2014%2C%202024",2024-02-28 21:18:12,2024-02-29 15:30:27.699963,0 days 18:12:15.699963,35,0.96,https://www.reddit.com/r/stocks/comments/1b2hr1z/salesforce_follows_metaannounces_dividend/
1b2yljb,stocks,Who do you watch?,"Since Bloomberg is wanting to cover politics on surveillance and the terrible screen burn inducing 1990s frames format, I’m watching it less now.  I can’t stand Joe Kernen on CNBC, so haven’t watched that in years.  What else is there for morning finance?",2024-02-29 11:55:54,2024-02-29 15:30:27.699968,0 days 03:34:33.699969,30,0.87,https://www.reddit.com/r/stocks/comments/1b2yljb/who_do_you_watch/
1b2jned,stocks,"Paramount falls short on revenue but posts profit, strong streaming results","Paramount Global missed revenue expectations for the fourth quarter on Wednesday but posted a surprise quarterly profit and posted strong results from its streaming platform Paramount+.

Here’s how Paramount performed in the fourth quarter compared to Wall Street estimates from LSEG, formerly known as Refinitiv:

Earnings per share: 4 cents vs. an expected loss of 1 cent

Revenue: $7.64 billion vs. $7.85 billion expected

For the last three months of 2023, Paramount reported a profit of $514 million, or 77 cents per share, up from $21 million, or 1 cent per share, the year prior. Adjusted for one-time items, earnings per share were 4 cents for the period.

Paramount — home to brands such as CBS, Showtime, BET, Nickelodeon and its namesake movie studio — reported a 6% year-over-year revenue decline but posted notable strides in its streaming segment.

Paramount+, its flagship streaming service, reached 67.5 million subscribers during the period, a net increase of 4.1 million, and recorded 69% revenue growth year over year. The company expects to achieve profitability for Paramount+ by 2025, it said Wednesday.

Subscription revenue in the fourth quarter grew 43%, partially driven by price increases, and revenue across its entire direct-to-consumer segment grew 34%.

Paramount saw a 27% jump in global viewing hours across Paramount+ and Pluto TV during the fourth quarter.

“Looking ahead, we continue to be focused on maximizing the return on our content investments and scaling streaming, while transforming the cost base of our business,” CEO Bob Bakish said in a press release. “And I couldn’t be more thrilled with the early momentum we’ve had across every platform in 2024, demonstrating the power of our strategy and assets.”

Paramount has been exploring sale options for all or parts of its business in recent months as the media landscape rapidly changes. Paramount has struggled without a solid growth narrative, with shares down more than 50% over the past two years.

Warner Bros. Discovery had been in preliminary talks to acquire Paramount, but those talks have since halted, CNBC’s Alex Sherman reported Tuesday.

Paramount announced about 800 layoffs earlier this month, just a day after the company revealed it had reached record viewership numbers for this year’s Super Bowl.

The company on Wednesday reported its TV media revenue declined 12% year over year. Advertising revenue declined 15% due to overall “softness in the global advertising market and 5-percentage point impact from lower political advertising,” according to the earnings release.

Revenue in Paramount’s filmed entertainment sector sank 31% year over year, driven by lower licensing revenue.

Source: https://www.cnbc.com/2024/02/28/paramount-global-para-earnings-q4-2023.html",2024-02-28 22:32:21,2024-02-29 15:30:27.699973,0 days 16:58:06.699974,38,0.93,https://www.reddit.com/r/stocks/comments/1b2jned/paramount_falls_short_on_revenue_but_posts_profit/
1b2hu4v,stocks,Salesforce slips after the company calls for single-digit revenue growth,"Salesforce shares slid 6% in extended trading on Wednesday after the business software maker issued a light revenue forecast for the new fiscal year. It will start paying a dividend at 40 cents per share.

Here’s how the company did, compared with estimates from LSEG:

Earnings per share: $2.29, adjusted, vs. $2.26 expected

Revenue: $9.29 billion, vs. $9.22 billion expected

Salesforce’s revenue grew 10.8% year over year in the quarter, which ended on Jan. 31, according to a statement. The company reported net income of $1.45 billion, or $1.47 per share, compared with a loss of $98 million, or 10 cents per share.

During the quarter, Salesforce said it would acquire sales commission software startup Spiff for undisclosed terms and was starting to sell its products on the Amazon Web Services marketplace.

Salesforce called for adjusted fiscal first-quarter earnings of $2.37 to $2.39 per share, with $9.12 billion to $9.17 billion in revenue. Analysts polled by LSEG had been expecting $2.20 in adjusted earnings per share on $9.15 billion in revenue.

For the new 2025 fiscal year, Salesforce said it sees adjusted earnings of $9.68 to $9.76 per share and $37.7 billion to $38.0 billion in revenue. The revenue figure implies 8.6% growth at the middle of the range. Analysts had expected $9.57 per share, along with $38.62 billion in revenue.

Excluding the after-hours move, Salesforce shares have risen about 14% so far this year, while the S&P 500 index has gained 6% over the same period.

Source: https://www.cnbc.com/2024/02/28/salesforce-crm-q4-earnings-report-2024.html",2024-02-28 21:21:25,2024-02-29 15:30:27.699977,0 days 18:09:02.699978,21,0.95,https://www.reddit.com/r/stocks/comments/1b2hu4v/salesforce_slips_after_the_company_calls_for/
1b2owx3,stocks,2 restaurants stocks: Cava and Portillo’s ,"The restaurants Cava and Portillo’s just published their annual reports within a day of each other. I’m not terribly good at interpreting financial results… but it’s crazy how different the market values them. Both emerging chains.

Annual revenue:
Cava: $717 million
Portillo’s: $680 million

Net income
Cava: $13.2 million
Portillo’s: $24.8 million

Store numbers
Cava: 309
Portillo’s: 84

Total assets:
Cava: $983 million
Portillo’s: $1.38 billion

Debt:
Cava: $342 million
Portillo’s: $300 million

Market capitalization:
Cava: $6.46 billion
Portillo’s: $1.12 billion

Why does the market think Cava is worth 5x that if Portillo’s? 
",2024-02-29 02:20:58,2024-02-29 15:30:27.699981,0 days 13:09:29.699982,37,0.83,https://www.reddit.com/r/stocks/comments/1b2owx3/2_restaurants_stocks_cava_and_portillos/
1b27suh,stocks,Stripe all but delays IPO. Valuation rises to $65B,"

Feb 28 (Reuters) - Stripe's valuation surged to $65 billion in a deal that will allow some of its employees to cash out their stock in the company, the payments service provider said on Wednesday.
The so-called ""tender offer"" could allow Stripe more flexibility with its plans to file for an initial public offering (IPO), which investors and analysts have been anticipating for years.
Stock-based payouts typically comprise a big chunk of the compensation for startup employees, who have no way of converting their shares into cash unless their employer files for an IPO, raises funds in a private round or buys back their shares.
Stripe and some of its investors have agreed to buy some shares of current and former Stripe employees, the company said.
It did not disclose the names of the investors participating in the round. But the Wall Street Journal, which first reported the deal, said Sequoia Capital and Goldman Sachs's growth equity fund were involved.
Stripe declined to comment beyond its statement.
The company was valued at $50 billion in its last funding round in 2023 where it raised $6.5 billion. It had then said that it did not need the capital to run its business but would use it to cover a tax bill and to provide liquidity to employees.

https://www.reuters.com/technology/stripe-valuation-jumps-65-bln-employee-share-sale-deal-wsj-2024-02-28/",2024-02-28 14:49:35,2024-02-29 15:30:27.699986,1 days 00:40:52.699986,67,0.97,https://www.reddit.com/r/stocks/comments/1b27suh/stripe_all_but_delays_ipo_valuation_rises_to_65b/
1b2cggq,stocks,What stock have you irrationally hang onto for a long time hoping it would explode?,"Over the years Ive build a nice stock portfolio which was created by a few big bangs that offset some loosing positions. However in some cases I have the feeling I'm holding on too long to some stocks and they will never take off. 

In my case:

Stock: CUV (ASX) or CLVLY:US

Time held: 11 years

Belief: 

Clinuvel (CUV) is an obscure Australian Pharma stock. They are profitable because they provide a treatment for people with extreme light sensitivity (EPP) which is small but very profitable as they are the only treatment. Their medicine Scenesse (afamelanotide) basically makes you tanned, makes you loose appetite and gives you a hard-on (my personal experience). They are working on a treatment for vitiglio (I'm confident it will work) and stroke (unsure) which are much bigger markets. By now I had expected that big Pharma would have bought them out years ago but it hasn't happened and at this stage their is a large change current management will do something dumb with the cash on hand, hence I'm thinking of trimming my position because the stock has been going nowhere for years...

I'm curious: what stock have you irrationally held for a  long time thinking it would take off but hasn't?

Disclaimer: I own CUV and CLVLY stock",2024-02-28 17:53:36,2024-02-29 15:30:27.699995,0 days 21:36:51.699995,489,0.88,https://www.reddit.com/r/stocks/comments/1b2cggq/what_stock_have_you_irrationally_hang_onto_for_a/
