id,subreddit,title,posttext,time_posted,time_now,time_difference,num_comments,upvote_ratio,url
1b123j1,stocks,"Alphabet Drops During Renewed Fears About Google’s AI Offerings, PE ratio less then S&P500.","Google is now the only Magnificient Seven stock that has a PE ratio less than the S&P500.

It's now valued at only 1.72 trillion, less than 57% of Microsoft.

Still has a really strong balance sheet, but I personally have been critical of Google's share buy backs in the past, because although they seem big, they barely cover the share issuances to its employees and executives (most of whom are over compensated considering google has no successful projects in the last decades, outside of Youtube Premium).

What are your thoughts, undervalued or correctly valued?

[https://www.bloomberg.com/news/articles/2024-02-26/alphabet-drops-amid-renewed-fears-about-google-s-ai-offerings?embedded-checkout=true](https://www.bloomberg.com/news/articles/2024-02-26/alphabet-drops-amid-renewed-fears-about-google-s-ai-offerings?embedded-checkout=true)

[https://www.theglobeandmail.com/investing/markets/stocks/GOOGL-Q/pressreleases/24348206/meet-the-only-magnificent-seven-stock-that-is-cheaper-than-the-sp-500/](https://www.theglobeandmail.com/investing/markets/stocks/GOOGL-Q/pressreleases/24348206/meet-the-only-magnificent-seven-stock-that-is-cheaper-than-the-sp-500/)

Edit: Changed billion to trillion",2024-02-27 03:46:34,2024-02-29 15:30:27.700100,2 days 11:43:53.700100,565,0.9,https://www.reddit.com/r/stocks/comments/1b123j1/alphabet_drops_during_renewed_fears_about_googles/
1b1goet,stocks,"Warner Bros. Discovery halts merger talks with Paramount Global, sources say ","Warner Bros. Discovery has gone “pencils down” on a potential acquisition of Paramount Global, halting talks after several months of kicking the tires on merging the media companies, according to people familiar with the matter.

Skydance Media, the film and TV studio run by David Ellison, is still performing due diligence on a potential transaction, two of the people said.

Paramount Global has set up a special committee, which has hired its own financial adviser, to sift through potential bids for the whole company or certain assets. Media mogul Byron Allen offered $14 billion for the company last month, though he has a history of bidding on and not buying large media assets.

Comcast, the owner of NBCUniversal, isn’t interested in acquiring Paramount Global assets, one of the people said. Comcast has been working with house bankers to explore a potential commercial partnership with Paramount Global, according to people familiar with the matter.

That could include bundling or merging streaming services Peacock and Paramount+, as previously reported by The Wall Street Journal, or a different arrangement. Still, it’s unclear if Paramount Global would have interest in this as it explores sale scenarios.

Spokespeople for Comcast, Paramount Global, Skydance Media and Warner Bros. Discovery declined to comment.

Warner Bros. Discovery Chief Executive Officer David Zaslav had a preliminary conversation with Paramount Global CEO Bob Bakish, CNBC reported in December. The companies engaged in more serious merger discussions in January, but talks have cooled off this month.

Warner Bros. Discovery shares fell 10% Friday after the company missed analyst targets for earnings and revenue. Shares have fallen 47% in the past year and are near a 52-week low.

Paramount Global is also trading close to a 52-week low as it prepares to announce its earnings Wednesday.

Source: https://www.cnbc.com/2024/02/27/warner-bros-discovery-halts-paramount-global-merger-talks.html",2024-02-27 16:53:19,2024-02-29 15:30:27.700104,1 days 22:37:08.700104,13,0.95,https://www.reddit.com/r/stocks/comments/1b1goet/warner_bros_discovery_halts_merger_talks_with/
1b2xw6u,stocks,"If a ceo or major player is selling stock, it’s game over, no?","Generally speaking. I’m super casual but any time I see a ceo or some big head in charge of company X selling X stock, it’s the biggest most up front red flag. 

But when you’re so invested, might be hard to want to see it, acknowledge it. ",2024-02-29 11:13:01,2024-02-29 15:30:27.700108,0 days 04:17:26.700108,42,0.09,https://www.reddit.com/r/stocks/comments/1b2xw6u/if_a_ceo_or_major_player_is_selling_stock_its/
1b1hyrz,stocks,Microsoft and Mistral AI announce new partnership to accelerate AI innovation and introduce Mistral Large first on Azure,">The AI industry is undergoing a significant transformation with growing interest in more efficient and cost-effective models, emblematic of a broader trend in technological advancement. In the vanguard is Mistral AI, an innovator and trailblazer. Their commitment to fostering the open-source community and achieving exceptional performance aligns harmoniously with Microsoft’s commitment to develop trustworthy, scalable, and responsible AI solutions.

>Today, we are announcing a multi-year partnership between Microsoft and Mistral AI, a recognized leader in generative artificial intelligence. Both companies are fueled by a steadfast dedication to innovation and practical applications, bridging the gap between pioneering research and real-world solutions.   

Haven't seen this posted yet (if I'm wrong please mods delete this post) and I believe this is a major step for AI.

",2024-02-27 17:43:53,2024-02-29 15:30:27.700112,1 days 21:46:34.700113,13,0.91,https://www.reddit.com/r/stocks/comments/1b1hyrz/microsoft_and_mistral_ai_announce_new_partnership/
1b1g2q3,stocks,Chip stock bubble ,"
I keep hearing about the chip stock AI induced bubble.

Stock prices and market cap of these stocks have shot up quickly to the stratosphere, so I understand the bubble concern. 

However, the valuation stocks like NVIDIA really doesn't seem outrageous based on earnings and predicted future earnings and the speed in which earnings are growing. 

Question:
Is because people believe these projected future earnings are way off?  Or because demand will eventually dry up and the stocks come cratering back to reality? 

What is the Bear vs bill argument on stocks like NVIDIA? 

I own a little NVIDIA and Broadcom, but I have basically been on the sideline while AI has taken over the world. I was shocked when I looked at current and future P/E and it wasn't quite as insane and the Bubble Bear news would suggest, despite its rapid climb. 

Interested to hear opinions.",2024-02-27 16:29:31,2024-02-29 15:30:27.700117,1 days 23:00:56.700117,40,0.83,https://www.reddit.com/r/stocks/comments/1b1g2q3/chip_stock_bubble/
1b1crxj,stocks,"Lowe's beats earnings estimates as sales fall, company expects 2024 revenue to fall","Lowe’s on Tuesday beat Wall Street’s quarterly earnings and revenue estimates, even as the company continued to see customers tackle fewer home projects.

The home improvement chain was going up against lower expectations for its fourth quarter. It had cut its full-year forecast in November, after CEO Marvin Ellison said the company had felt a “greater-than-expected pullback” on pricier items and discretionary home projects.

Lowe’s said it factored economic uncertainty into its forecast for the current fiscal year, too. It said it expects total sales of between $84 billion and $85 billion, which would be a drop from $86.38 billion in fiscal 2023. It anticipates comparable sales will decline between 2% and 3% compared with the prior year, and expects earnings per share of approximately $12 to $12.30.

Here’s what the company reported for the fourth quarter compared with what Wall Street was expecting, based on a survey of analysts by LSEG, formerly known as Refinitiv:

Earnings per share: $1.77 vs. $1.68 expected

Revenue: $18.60 billion vs. $18.45 billion expected

The company’s net income for the three-month period that ended Feb. 2 was $1.02 billion, or $1.77 per share, compared with $957 million, or $1.58 per share, a year earlier. Excluding the costs associated with Lowe’s sale of its Canadian retail business, earnings per share were $2.28.

Sales fell from $22.45 billion in the year-ago period. The company said its prior-year quarter included an additional week and sales from its Canadian business.

Comparable sales dropped by 6.2% year over year, as the home improvement retailer saw weaker demand for do-it-yourself projects and poor weather in January. Comparable sales for home professionals, a category that includes plumbers, electricians and contractors, were flat year over year in the quarter, however.

During the fourth quarter, Lowe’s spent $404 million on share buybacks and paid $633 million in dividends.

As of Monday’s close, Lowe’s shares were up nearly 4% this year. That trails the approximately 6% gains of the S&P 500 during the same period. Shares of Lowe’s closed at $231.32 on Monday, bringing the company’s market value to about $133 billion.

Rival Home Depot last week beat Wall Street’s earnings and revenue expectations, but its sales fell year over year and the retailer’s leaders described the past year as one of “moderation” after unusually high demand during the pandemic. The company also said customers were continuing to put off bigger projects because of higher interest rates.

Source: https://www.cnbc.com/2024/02/27/lowes-low-q4-2023-earnings.html",2024-02-27 14:11:39,2024-02-29 15:30:27.700121,2 days 01:18:48.700122,4,0.96,https://www.reddit.com/r/stocks/comments/1b1crxj/lowes_beats_earnings_estimates_as_sales_fall/
1b1i87o,stocks,Reddit Files S1 for IPO,"Reddit, Inc. files their S1, marking the first social media IPO since Pinterest five years ago. Here are some interesting takeaways for me…

  
\- Average revenue per user is $3.42, but that is buoyed heavily by the US cohort that has a $5 ARPU vs. $1 ARPU globally. Compare this to Facebook’s ARPU in US/Canada of $68.44.

  
\- 98% of revenue is from their ads (they have some freemium features but they never really made an impact) but the big question mark is can they monetize the API side and license their data to LLMs. Reddit’s $60m Google licensing deal right on the eve of this S1 is likely to build confidence there, but licensing still feels like the big unknown when it comes to monetization.

  
\- Reddit gets a massive portion of revenue from just a few top advertisers. CJ Gustafson notes in his analysis of the S1, “The company's advertising revenue is mainly derived from a small number of advertisers, with the top ten largest customers accounting for approximately 28% and 26% of its revenue for 2022 and 2023, respectively.”

  
\- R&D is 54% of revenue so they are investing heavily here. It feels like Reddit is looking to really lean into new monetization paths moving forward but these are untested.Overall, Reddit is one of the most anticipated IPOs of 2024 (dwarfed only by potentially Stripe).

  
I think there is a lot to be excited about, but also a lot of unknowns as Reddit moves to this next growth chapter.",2024-02-27 17:54:36,2024-02-29 15:30:27.700125,1 days 21:35:51.700126,21,0.76,https://www.reddit.com/r/stocks/comments/1b1i87o/reddit_files_s1_for_ipo/
1b1i5rt,stocks,Norwegian Cruise Line reports first profitable year since 2019,"Norwegian Cruise Line Holdings on Tuesday reported its first profitable year since 2019 as fourth-quarter losses narrowed dramatically.

The cruise company reported strong growth and ticket demand with an encouraging 2024 forecast. Shares of the company surged 17% following the report.

Here’s how Norwegian performed in the fourth quarter compared with estimates from LSEG, formerly known as Refinitiv:

Loss per share: 18 cents vs. 14 cents expected

Revenue: $1.99 billion vs. $1.97 billion expected

For the last three months of 2023, Norwegian reported a net loss of $106.5 million, an improvement from a loss of $482.5 million in the year-ago period. The company’s loss per share narrowed to 25 cents from $1.14 the prior year. Adjusting for one-time items, Norwegian reported a loss per share of 18 cents.

For the full year, the company generated total revenue of $8.55 billion, a 32% increase from 2019, with a net income of $166.2 million. In 2022, Norwegian lost $2.27 billion.

The company saw 102.9% occupancy for the year. Total revenue per passenger per day increased 17% from pre-pandemic levels.

The company said it received robust demand for most of its cruises except those traveling through the Middle East, which were canceled due to the violence in Gaza. The cancellations only caused a slight dip in occupancy in the fourth quarter to 99.2%, the company said.

“Norwegian Cruise Line Holding experienced a momentous year of growth and achievement in 2023,” CEO Harry Sommer said in a statement. “We successfully took delivery of three new ships, one for each of our brands, representing the most deliveries in a single year in our Company’s 57-year history. This important milestone showcases our dedication to innovation and commitment to providing exceptional vacation experiences for our guests.”

The company said it’s currently at record-high booking levels due to “healthy consumer demand” across the fourth quarter and full year.

For the full year 2024, the company expects an adjusted profit of about $635 million, or $1.23 per share, and an occupancy rate of about 105%. Analysts polled by LSEG had anticipated 2024 earnings per share of $1.21.

Shares of other cruise companies, including Royal Caribbean Cruises and Carnival Corp., also rose Tuesday morning.

Source: https://www.cnbc.com/2024/02/27/norwegian-cruise-line-nclh-earnings-q4-2023.html",2024-02-27 17:51:44,2024-02-29 15:30:27.700129,1 days 21:38:43.700129,1,0.92,https://www.reddit.com/r/stocks/comments/1b1i5rt/norwegian_cruise_line_reports_first_profitable/
1b1fxoy,stocks,"""This is not a bubble."" When was the last time this statement was true?","covid. weed. crypto. spacs. real estate bubble.

How many times has ""Morons, this is not a bubble"" turned out to be true?

A lot of people seem super damn confident AI is not a bubble, despite AI errors and questionable monetization? If something like gemini is such a controversial product, what makes people confident that a whole lot of companies want to spend lots of money to be guinea pigs, and this is not just a temporary chase/euphoria phase?

I digress. back to the main question... ""this is not a bubble, moron."" ?",2024-02-27 16:23:50,2024-02-29 15:30:27.700133,1 days 23:06:37.700133,90,0.58,https://www.reddit.com/r/stocks/comments/1b1fxoy/this_is_not_a_bubble_when_was_the_last_time_this/
1b113lx,stocks,Unity shares sink on weak guidance,"Unity Software shares plummeted 17% in extended trading on Monday after the gaming software company issued weaker-than-expected guidance for the current quarter.

Here’s how the company did:

Earnings per share: Loss of 66 cents. The results may not be comparable to the 46 cent loss predicted by analysts according to LSEG, formerly known as Refinitiv

Revenue: $609 million vs. $596 million expected by analysts, according to LSEG

Unity said it expects first-quarter adjusted earnings of $45 million to $50 million, below the $113 million that analysts were expecting.

The company said going forward, it would only provide revenue guidance for its “strategic portfolio,” which includes its engine, cloud and monetization business units. Unity said in January that it would cut 1,800 jobs as part of a corporate restructuring plan that included ending efforts deemed to be “non-strategic,” such as professional services and the Luna marketing business.

The company said first-quarter guidance for its strategic portfolio would come in between $415 million and $420 million. Analysts were expecting total first-quarter revenue of $534 million.

“We are right sizing our cost structure to grow from a healthy financial position,” Unity said in a shareholder letter. “This includes the previously announced reduction of approximately 25% of our workforce, in addition to cloud hosting cost savings, office footprint consolidation, and software license optimization.”

Unity said fourth-quarter revenue jumped 35% from $451 million a year earlier, while its net loss narrowed to $254 million from close to $288 million a year ago.

In October, John Riccitiello retired as Unity’s CEO and was replaced by former Red Hat chief James Whitehurst as interim CEO. Riccitiello’s departure came shortly after Unity announced a pricing change that upset several video game developers.

“We are committed to increasing shareholder value through revenue growth, margin expansion, and free cash flow generation and we believe that the steps we have taken in the past few months position us for success in 2024 and beyond,” Unity said in its shareholder letter.

Source: https://www.cnbc.com/2024/02/26/unity-u-earnings-q4-2023.html",2024-02-27 02:58:18,2024-02-29 15:30:27.700137,2 days 12:32:09.700137,91,0.96,https://www.reddit.com/r/stocks/comments/1b113lx/unity_shares_sink_on_weak_guidance/
1b186uq,stocks,How do you fight the “I should have”?,"I’m still a newbie in investing, only been doing it for 4 years, and in the beginning it was a mess, frequently replacing my stocks because of rumors, or sold everything on “crash is coming” news. Now I’m much more calm, I survived -30% (solar) without quitting, and now up 25%.
Even though I’m much more rational, “I should have bought more NVDA” always comes back.
For 5 years I’ve been working with AI/ML in depth, with bare models, and even then (when ChatGPT was nowhere, and AI was a gimmick) I knew this is capable of anything. But I didn’t invest enough in it being a newbie, and listen to analysts who probably knew nothing about how AI is working and the potential in it (at least learnt that analysts opinions are just worthless).
Now 14% of my portfolio is NVDA (definitely the main driver of my portfolio), but I still feel like I will regret it not having more in it.
I know 14% is already not “diversified enough”, but it’s more rational than listening to my guts (would raise that 14% to 30% at least).
I know that this “should have” can go either way though.
When I had 40% of my portfolio in solar, for almost 2 years going down every single week was very hard to swallow, and then I said “I should have” bought less.
Every time I have this, I realise the only thing that can really help is diversifying, but it’s hard to silence gut feelings, and be completely rational.
Does this happen to you too? How do you fight it?",2024-02-27 09:54:32,2024-02-29 15:30:27.700141,2 days 05:35:55.700141,81,0.82,https://www.reddit.com/r/stocks/comments/1b186uq/how_do_you_fight_the_i_should_have/
1b1ctk9,stocks,Macy’s posts another quarter of falling sales as it unveils strategy to get back to growth,"Macy’s on Tuesday said sales fell nearly 2% in the holiday quarter, as the 166-year-old department store operator unveiled its strategy to get back to growth. 

Here’s what Macy’s reported for the fourth quarter compared with what Wall Street was expecting, based on a survey of analysts by LSEG, formerly known as Refinitiv:

Earnings per share: $2.45 adjusted vs. $1.96 expected
Revenue: $8.12 billion vs. $8.15 billion expected
The retailer said it expects sales to remain stagnant. It projected net sales of between $22.2 billion to $22.9 billion for this fiscal year, down from $23.09 billion in 2023. It anticipates comparable sales, which take out the impact of store openings and closures, will range from a decline of about 1.5% to a gain of 1.5% compared with the year-ago period on an owned-plus-licensed basis and including third-party marketplace sales.

Yet the company’s new CEO Tony Spring laid out a brighter outlook for the following fiscal year and how Macy’s plans to get there. Spring is the former CEO of Macy’s higher-end department store Bloomingdale’s. He took the helm earlier this month, weeks after Macy’s announced layoffs and as it faced pressure from activist investors.

In an interview with CNBC, he said the company is taking a clear-eyed look at its business — particularly its struggling namesake stores.

“Yes, there are headwinds, certainly on discretionary categories and the middle-income consumer, but we take responsibility for what we control,” he said. “Let’s put better products into our stores. Let’s make sure it’s merchandised appropriately at a decent value. And then we have more opportunity for conversion and more [market] share.”

As part of the retailer’s push to woo shoppers and restore investor confidence, Macy’s said it will make big changes to its store footprint. Macy’s plans to close about 150 unproductive locations and to prioritize investing in about 350 other namesake locations.

It plans to focus more on selling luxury goods by opening about 15 new Bloomingdale’s stores and at least 30 new Bluemercury stores over the next three years. It will also remodel roughly 30 existing stores of the beauty chain during that time. 

Macy’s had already announced five store closures and more than 2,300 layoffs last month. It also said last year that it would open up to 30 smaller versions of its namesake stores in strip malls over the next two years.

In a news release on Tuesday, Macy’s said it will also take a hard look at how to operate more efficiently – such as scrutinizing the network of warehouses used for its e-commerce business.

In the fiscal year that starts in early 2025, Macy’s said it expects low-single digit comparable sales growth on an annual basis, including owned, licensed and marketplace sales. It said it expects capital spending to fall below 2024 levels and free cash flow to drop to pre-pandemic levels. Its outlook does not include any potential impact from a proposed credit card late fee ruling by the federal government. 

Macy’s, which includes its namesake banner, Bloomingdale’s and Bluemercury, has faced scrutiny from activist investors Arkhouse Management and Brigade Capital Management, who made a rejected bid to buy the retailer. Arkhouse recently nominated a slate of nine directors to Macy’s board.

For the fiscal fourth quarter that ended Feb. 4, Macy’s swung to a loss of $71 billion, or 26 cents per share, from net income of $508 million, or $1.83 per share, a year earlier. The losses included $1 billion of impairment and restructuring costs related to Macy’s plans to close about 150 locations, which are part of its turnaround strategy.

Revenue fell from $8.26 billion in the year-ago period. Digital sales declined 4% compared to the prior-year quarter and brick-and-mortar sales were roughly flat.

Across the company, comparable sales on an owned-plus-licensed basis fell 4.2% from the year-ago period. That was better than the 5.8% decline that analysts expected, according to LSEG.

Macy’s continued to be the weakest store banner – a trend reflected in the company’s plans to close many of its stores. The namesake store’s comparable sales on an owned-plus-licensed basis dropped by 4.7%, as the women’s shoes and cold weather apparel and accessories categories struggled. Beauty and Macy’s off-price business, Backstage, were stronger performers in the quarter. 

Bloomingdale’s and Bluemercury, the two store chains that the parent company plans to expand, both fared better in the holiday quarter. 

At Bloomingdale’s, comparable sales declined 1.6% on an owned-plus-licensed basis, as the men’s and designer handbag businesses came in soft.

Bluemercury’s comparable sales rose 2.3%, as shoppers bought skincare items and color cosmetics. 

Net credit card revenue also took a hit, as Macy’s said it tumbled by 26% from the prior year to $195 million as the company dealt with higher net credit card losses. 

So far this year, shares of Macy’s have fallen about 4%. The company’s stock has underperformed the approximately 6% gains of the S&P 500 during the same period. Shares of Macy’s closed Monday at $19.30, bringing the company’s market value to $5.29 billion.

Source: https://www.cnbc.com/2024/02/27/macys-m-q4-2023-earnings-.html",2024-02-27 14:13:41,2024-02-29 15:30:27.700145,2 days 01:16:46.700145,4,0.85,https://www.reddit.com/r/stocks/comments/1b1ctk9/macys_posts_another_quarter_of_falling_sales_as/
