id,subreddit,title,posttext,time_posted,time_now,time_difference,num_comments,upvote_ratio,url
1b0mfcq,stocks,Are there any Hedge Funds for the Little Guy?,"I made some really ballsy bets in the market and have had massive successes, but I have no fantasy that I can somehow repeat this. 

I diversified a lot, and I want to continue to diversify even more.

At the moment, the only weakness my portfolio seems to have is that it is vulnerable to recessions. Now, obviously everyone is vulnerable to recessions. But apparently there's something called a hedge fund, and apparently they're called hedge funds because they're at least supposed to hedge against the market. 

When times are tough, say I get laid off etc, I don't want to have to sell my stocks at a loss to dip into them...even if it's not really a loss because I'm still way up. I want to sell at a profit no matter what, so, are hedge funds right for me?

But it seems all the most well-reputed hedgefunds have some serious capital requirements and fees. Frankly as a money-grubbing east coaster I have no desire for any fees nor do I have a gazillion dollars. 

So, what are some assets/stocks that famously hedge against the market? Just based on reputation I'm gonna assume it's stuff like gold/silver/oil or something?",2024-02-26 16:58:01,2024-02-29 15:30:27.700290,2 days 22:32:26.700290,24,0.45,https://www.reddit.com/r/stocks/comments/1b0mfcq/are_there_any_hedge_funds_for_the_little_guy/
1azlmvm,stocks,Thoughts on PLTR and SHOP? I don't see why they are so popular now,"I constantly hear about these two stocks for the past months. 

Analysts write articles everywhere! Popping on news feeds etc.

Given how they are discussed frequently online, I decided to take a look. Each company is taking advantage of the AI trend. PLTR using AI in their software for counter-terrorism investigations and SHOP using AI to further develop websites for individuals who wish to build an online store for marketing their product. 

Each company enjoyed a surge in 2021's pandemic / stock frenzy time but has since declined after stock correction in 2022. Both are now under pressure by investors' expectations from the AI trend's test of practicality. Seems clearcut and reasonable for the hype?

From a technical perspective, both stocks stink. A negative EPS with P/E Ratio of over 200 happening quite often. Recently, PTLR's EPS hits a positive of 0.09 and SHOP's EPS a 0.07, not impressive at the least. Their P/E Ratio is most telling with a 260 and 1011 respectively.

Yup, you are reading that correctly, a P/E ratio of over 1000... I haven't been investing for over 10 years but it is my first time seeing a 4 figure P/E ratio. 

TLDR: My conclusion? Confusion. I don't understand where the hype is and how it is justified based on the technicalities of both companies. Their finances stink and their AI potential seems more of a joining the bandwagon maneuver. 

Yet, they are so popular! PLTR has over a 50B market cap and SHOP has over 200B market cap, which put them in a large cap! What is going on? What is everyone's thoughts on this?",2024-02-25 11:18:49,2024-02-29 15:30:27.700294,4 days 04:11:38.700294,86,0.72,https://www.reddit.com/r/stocks/comments/1azlmvm/thoughts_on_pltr_and_shop_i_dont_see_why_they_are/
1az6lim,stocks,"The market dips 30%, you have liquid capital, what are some of the stocks you look at first?","Hi all,

So I'm a newish investor and currently researching various stocks and trying to build a watchlist of stocks I'd be interested in if/when a correction/dip were to occur. 

I try to note new stocks I run across in my reading to research further and I'd like to hear what others here have on their must buy / watch lists in the event of a dip, especially the one off's you don't see talked about much. 

So what are some of your favorites?

TIA!",2024-02-24 21:56:01,2024-02-29 15:30:27.700298,4 days 17:34:26.700298,321,0.76,https://www.reddit.com/r/stocks/comments/1az6lim/the_market_dips_30_you_have_liquid_capital_what/
1ayui9i,stocks,"Berkshire Hathaway Q4 operating earnings climb 28%, cash pile tops $167B","Berkshire Hathaway (NYSE:BRK.B) (NYSE:BRK.A) Q4 operating earnings rose 28% from a year ago, driven by improvements in insurance underwriting and investment income, which more than offset declines at its railroad, utilities and energy, and other businesses.

The company doubled the amount of its common stock it repurchased to $2.2B during the quarter compared with $1.1B in Q3, bringing 2023 purchases to $9.2B.

The investment titan held ~$167.6B in cash and short-term securities on its balance sheet as of Dec. 31, 2023, climbing from $157B at Sept. 30.

Q4 operating income of $8.48B declined from $10.8B in Q3 and increased from $6.63B a year ago.

Overall operating earnings for the year increased to $37B from $30B year over year. Total revenues increased to $364B from $306B year over year 


[Link to annual shareholder letter](https://www.berkshirehathaway.com/2023ar/linksannual23.html)",2024-02-24 13:26:38,2024-02-29 15:30:27.700301,5 days 02:03:49.700302,284,0.96,https://www.reddit.com/r/stocks/comments/1ayui9i/berkshire_hathaway_q4_operating_earnings_climb_28/
1az5bf4,stocks,What made investors interested in japanese stock market again? Like Berkshire hathaway?,"All,

So the japanese stock market has finally hit a new all time high. The last time this happened was 34 years ago.

Their economy has been stagnant since decades now and recently also slipped into recession. I can't understand what made investors gain so much faith in japanese market. Especially Berkshire hathaway which is quite risk averse and invests patiently into quality companies.",2024-02-24 21:03:33,2024-02-29 15:30:27.700305,4 days 18:26:54.700305,80,0.92,https://www.reddit.com/r/stocks/comments/1az5bf4/what_made_investors_interested_in_japanese_stock/
1aywt2g,stocks,Charlie Munger – The Architect of Berkshire Hathaway,"Warren Buffett's tribute to his dear friend and investing Titan, Charlie Munger.  Bold is Buffett's own emphasis:

>Charlie Munger died on November 28, just 33 days before his 100th birthday.

>Though born and raised in Omaha, he spent 80% of his life domiciled elsewhere. Consequently, it was not until 1959 when he was 35 that I first met him.

>In 1962, he decided that he should take up money management.

>Three years later he told me – correctly! – that I had made a dumb decision in buying control of Berkshire. **But**, he assured me, since I had already made the move, he would tell me how to correct my mistake.

>In what I next relate, bear in mind that Charlie and his family did not have a dime invested in the small investing partnership that I was then managing and whose money I had used for the Berkshire purchase. Moreover, neither of us expected that Charlie would ever own a share of Berkshire stock.

>Nevertheless, Charlie, in 1965, promptly advised me: “Warren, forget about ever buying another company like Berkshire. But now that you control Berkshire, add to it wonderful businesses purchased at fair prices and give up buying fair businesses at wonderful prices. In other words, abandon everything you learned from your hero, Ben Graham. It works but only when practiced at small scale.” With much back-sliding I subsequently followed his instructions.

>Many years later, Charlie became my partner in running Berkshire and, repeatedly, jerked me back to sanity when my old habits surfaced. Until his death, he continued in this role and together we, along with those who early on invested with us, ended up far better off than Charlie and I had ever dreamed possible.

>In reality, Charlie was the “architect” of the present Berkshire, ad I acted as the “general contractor” to carry out the day-by-day construction of his vision.

>Charlie never sought to take credit for his role as creator but instead let me take the bows and receive the accolades. In a way his relationship with me was part older brother, part loving father. Even when he knew he was right, he gave me the reins, and when I blundered he never – **never** –reminded me of my mistake.

>In the physical world, great buildings are linked to their architect while those who had poured the concrete or installed the windows are soon forgotten. Berkshire has become a great company. 

>Though I have long been in charge of the construction
crew; **Charlie** should **forever** be credited with being the architect.",2024-02-24 15:12:55,2024-02-29 15:30:27.700309,5 days 00:17:32.700309,32,0.96,https://www.reddit.com/r/stocks/comments/1aywt2g/charlie_munger_the_architect_of_berkshire_hathaway/
1azatp7,stocks,When will fintech get back to its 2021 valuation highs?,"I was looking at F-Prime's fintech index. The overall fintech sector has really taken a beating. 

https://imgur.com/S7rotAp
(Source: https://fintechindex.fprimecapital.com/)

Besides interest rates, what other factors will play a role in fintech getting back to those highs?

I've noticed [Nubank](https://www.google.com/finance/quote/NU:NYSE?window=5Y) has seemed to nearly recover. My feeling is that its a bit unique because of its focus in the Latin American market (not to mention the confidence boost from the Buffet investment).",2024-02-25 00:57:26,2024-02-29 15:30:27.700313,4 days 14:33:01.700313,22,0.75,https://www.reddit.com/r/stocks/comments/1azatp7/when_will_fintech_get_back_to_its_2021_valuation/
1ayxzr2,stocks,"Why are analysts so focused on user growth for companies like Facebook, Instagram, etc. when fake accounts obviously seem to be rising ","I mean is it not reasonable to assume that user growth could come in the form of fake bot accounts? Theoretically a user base could grow infinitely especially with the emergence of AI technologies that are much better at making fake accounts appear real. These fake accounts sure on paper make it seem like the company is growing, but in reality those accounts are not contributing to organic growth. 

In the same vain, what’s to stop these companies from creating said fake accounts (or at the very least encouraging it) through some off the books bot farms. I mean most advertisements pay based on engagement (pay per click or impressions) so these companies are incentivized realistically to have these fake accounts on their platforms engaging with the users, thus generating advertisement income. The whole thing just seems like a scam and who is actually auditing these things to ensure this behavior isn’t being conducted?  Are we just taking it on faith that these companies don’t behave in this deceptive behavior?  ",2024-02-24 16:03:17,2024-02-29 15:30:27.700317,4 days 23:27:10.700317,72,0.89,https://www.reddit.com/r/stocks/comments/1ayxzr2/why_are_analysts_so_focused_on_user_growth_for/
1az2k8k,stocks,How does hedging save your portfolio? Isn’t it just reversing your profits?,"I’m so confused. If you use a hedge, like shorting a long position or buying puts, aren’t you just reversing your gains and therefore breaking even every time? It sounds like shorting a stock while also buying long in that same stock is just the same thing as not buying any of the stock to begin with; if you “win” one then you automatically “lose” the other. No matter what. That’s breaking even.

What am I missing? I know I’m obviously not understanding how this works. Someone please explain what part of my thought process is broken.

(Edited to correct backwards wording)",2024-02-24 19:09:17,2024-02-29 15:30:27.700321,4 days 20:21:10.700321,91,0.82,https://www.reddit.com/r/stocks/comments/1az2k8k/how_does_hedging_save_your_portfolio_isnt_it_just/
1az0nzm,stocks,Teaching Kids About Stocks,"I teach high school financial literacy. Currently, we are studying the stock market. Nothing too crazy, but basics like tickers, moving averages, quotes, splits, and dividends. I have them competing to put together $100,000 portfolios where they have to pick at least four companies. I did not assist outside of showing them good resources and how to read basic elements such as income statements for revenue and earnings trends, balance sheets for assets and liabilities, and statements of cash flow for free cash flow.

Here are the top ten picks:

|*Top 10 Picks*|*42.23% of total net picks*|
|:-|:-|
|Apple Inc. (XNAS: $AAPL)|8.42%|
|[Amazon.com](https://Amazon.com), Inc. (XNAS: $AMZN)|6.31%|
|Microsoft Corporation (XNAS: $MSFT)|5.74%|
|NVIDIA Corporation (XNAS: $NVDA)|4.86%|
|Sony Group Corporation (XNYS: $SONY)|3.11%|
|Tesla, Inc. (XNAS: $TSLA)|3.00%|
|The Coca-Cola Company (XNYS: $KO)|2.96%|
|Alphabet Inc. (XNAS: $GOOG)|2.82%|
|Walmart Inc. (XNYS: $WMT)|2.59%|
|Netflix, Inc. (XNAS: $NFLX)|2.41%|

I will keep you updated on how they do. Thanks for allowing me to share.",2024-02-24 17:52:05,2024-02-29 15:30:27.700331,4 days 21:38:22.700332,50,0.9,https://www.reddit.com/r/stocks/comments/1az0nzm/teaching_kids_about_stocks/
1ayxn6v,stocks,"I did a comparison of PE by sector for US, Japan, Europe and China","Added India as well:  
[https://imgur.com/L9Qm9L7](https://imgur.com/L9Qm9L7)

Since everyone is calling for current US market overvaluation, I wanted to check out if US stocks are really as overvalued as people are saying by different countries and each sector individually.  
So I did manually, based on trailing PE weighted by market cap.

You can take your own conclusions, to me the situation doesn't look so bad.  
The only apparent overvaluation looks in the electronic technology sector, but we all know the reason (AI/GPU wave).

Data was pulled from TradingView and few mistakes/outliers were adjusted manually.

**Edit:**  
Interesting enough, consumer durables overvaluation is due to TSLA alone.

**Edit:**  
Added india NIFTY 500 also to the group:  
[https://imgur.com/L9Qm9L7](https://imgur.com/L9Qm9L7)  
Few outliers were removed since were messing up the final results.  
India is way more expensive than US.",2024-02-24 15:48:34,2024-02-29 15:30:27.700335,4 days 23:41:53.700336,44,0.88,https://www.reddit.com/r/stocks/comments/1ayxn6v/i_did_a_comparison_of_pe_by_sector_for_us_japan/
1azy1h0,stocks,Shorting Intuit (Turbo Tax),"I’m thinking of shorting intuit. 

With the recent mass layoffs of software engineers across the entire private sector industry, in combination with the fact that more people are enlightened by Turbo Tax’s shitty business practices every year (keeping taxes hard to do by lobbying), I really think the stock will crater in the next 3-5 years.

As for why the layoffs are relevant, SWEs are having trouble finding work in the private sector- and I imagine they will start turning to public sector jobs- the IRS being one of them. The public sector will be slower to incorporate AI and that’s where the jobs will really be available in the future.

Imagine the IRS finally gets some talented SWEs and release a free tax interface that competes with Turbo Tax… Turbo Tax would be in huge trouble.

Just some thoughts.",2024-02-25 20:30:28,2024-02-29 15:30:27.700339,3 days 18:59:59.700340,78,0.43,https://www.reddit.com/r/stocks/comments/1azy1h0/shorting_intuit_turbo_tax/
1ay2u1j,stocks,How is reddit not making a profit?,"No, i'm not even thinking about investing in it.  But reading about the IPO it is still not profitable?How is that possible?A brilliant program that magically elevates good content and is the go to place for 70 million daily active users.How are they not making money and what the hell will they do with investor money that they are not doing now?All this time i thought it was a cash cow.  


EDIT:  Wow, the thread really took off.   Surprised how many people brilliantly answer the question the subject without reading the post or the other 245 times the question was answered the same way.   I suppose i should have been more clear.   


I love reddit but i never paid much attention to it as a company.    ",2024-02-23 15:12:02,2024-02-29 15:30:27.700343,6 days 00:18:25.700344,751,0.87,https://www.reddit.com/r/stocks/comments/1ay2u1j/how_is_reddit_not_making_a_profit/
1ay54jj,stocks,NVDA 10k filing: “Customer A” contributed 13% of total revenue in FY2024.,"Some quotes

“We receive a significant amount of our revenue from a limited number of customers within our distribution and partner network. Sales to one customer, Customer A, represented 13% of total revenue for fiscal year 2024, which was attributable to the Compute & Networking segment. 

“One indirect customer which primarily purchases our products through system integrators and distributors, including through Customer A, is estimated to have represented approximately
19% of total revenue for fiscal year 2024, attributable to the..”

While revenue is concentrated don’t think its a worry unless macroeconomic changes force those companies to slow down buying nvda products.

Reason to believe that is either MSFT or Amazon.

",2024-02-23 16:43:52,2024-02-29 15:30:27.700347,5 days 22:46:35.700348,183,0.95,https://www.reddit.com/r/stocks/comments/1ay54jj/nvda_10k_filing_customer_a_contributed_13_of/
1ay60ju,stocks,Block shares surge after company announces surprise profit,"Block stock rose 20% in Friday morning trading after the payments company reported fourth-quarter earnings that beat analyst estimates on gross profit and showed strong growth in its Square and Cash App revenue.

Here’s how the company did, compared to an analyst consensus from LSEG, formerly Refinitiv:

Earnings per share: 45 cents, adjusted. Not comparable to estimates.

Revenue: $5.77 billion vs. $5.70 billion expected

Block posted $2.03 billion in gross profit, up 22% from a year ago. Analysts tend to focus on gross profit as a more accurate measurement of the company’s core transactional businesses.

The company raised its adjusted EBITDA forecast to at least $2.63 billion from $2.40 billion.

Block, formerly known as Square, ended the year with 56 million monthly transacting actives for Cash App in December, with most of those customers using it for either peer-to-peer payments or the Cash App Card.

Its Cash App business reported $1.18 billion in gross profit, a 25% year-over-year rise.

The company, which is run by Jack Dorsey, said its Cash App Card has 23 million monthly actives in December, up 20%. That is more than two times the growth rate of total monthly actives.

“We believe this strategy will enable us to build the largest network in the long run, with a highly engaged customer base using Cash App as their primary banking solution,” Dorsey said in a note to shareholders.

The payments firm has focused on slimming down operations in recent months. In January, the Block CEO reportedly said in a note to staffers that the company had laid off a “large number” of workers. This followed another round of layoffs in December.

Dorsey said in his note to shareholders that the company was now below a previously set cap of 12,000 employees.

“We’re going to operate under this cap until we feel it’s holding us back, which is likely years out,” Dorsey wrote. The company recorded a $70 million charge for severance costs.

The company also took an $132 million impairment on its investment in music streaming service Tidal. Block and Dorsey have had a mixed dealmaking record. The company sold delivery service Caviar to DoorDash in 2019 in a $410 million cash-and-stock deal. It also acquired Afterpay in 2021 for $29 billion, its largest acquisition ever.

Afterpay has struggled since the deal announcement, posting successive quarters of losses throughout 2022. Dorsey said in his note to shareholders that integrating Afterpay more tightly into Cash App and using it to power Cash App’s buy-now, pay-later technology were two focuses for 2024.

Block’s strong quarterly results and full-year outlook prompted Wall Street analysts to upgrade their rating of the stock on Friday.

Wells Fargo upgraded Block to overweight and raised its price target from $65 to $95, while Seaport Research Partners upgraded the stock to a buy and also hiked its price target to $95.

“SQ’s progress over the past several months in terms of streamlining itself organizationally, sharpening its focus within its two key businesses Square and Cash App, and becoming hyper-focused on driving profitable growth has been impressive,” the Seaport Research Partners analysts wrote. “We think there’s more to go.”

Source: https://www.cnbc.com/2024/02/22/block-sq-earnings-q4-2023.html",2024-02-23 17:18:13,2024-02-29 15:30:27.700356,5 days 22:12:14.700357,84,0.95,https://www.reddit.com/r/stocks/comments/1ay60ju/block_shares_surge_after_company_announces/
1ayrgpy,stocks,"/r/Stocks Weekend Discussion Saturday - Feb 24, 2024","This is the weekend edition of our stickied discussion thread.  Discuss your trades / moves from last week and what you're planning on doing for the week ahead.

Some helpful links:

* [Finviz](https://finviz.com/quote.ashx?t=spy) for charts, fundamentals, and aggregated news on individual stocks
* [Bloomberg market news](https://www.bloomberg.com/markets)
* StreetInsider news:
  * [Market Check](https://www.streetinsider.com/Market+Check) - Possibly why the market is doing what it's doing including sudden spikes/dips
  * [Reuters aggregated](https://www.streetinsider.com/Reuters) - Global news

If you have a basic question, for example ""what is EPS,"" then google ""investopedia EPS"" and click the investopedia article on it; do this for everything until you have a more in depth question or just want to share what you learned.

Please discuss your portfolios in the [Rate My Portfolio sticky.](https://www.reddit.com/r/stocks/search?q=author%3Aautomoderator+title%3A%22Rate+My+Portfolio%22&restrict_sr=on&sort=new&t=all).

See our past [daily discussions here.](https://www.reddit.com/r/stocks/search?q=author%3Aautomoderator+%22r%2Fstocks+daily+discussion%22&restrict_sr=on&sort=new&t=all)  Also links for:  [Technicals](https://www.reddit.com/r/stocks/search?q=author%3Aautomoderator+title%3Atechnicals&restrict_sr=on&include_over_18=on&sort=new&t=all) Tuesday, [Options Trading](https://www.reddit.com/r/stocks/search?q=author%3Aautomoderator+title%3Aoptions&restrict_sr=on&include_over_18=on&sort=new&t=all) Thursday, and [Fundamentals](https://www.reddit.com/r/stocks/search?q=author%3Aautomoderator+title%3Afundamentals&restrict_sr=on&include_over_18=on&sort=new&t=all) Friday.",2024-02-24 10:30:19,2024-02-29 15:30:27.700363,5 days 05:00:08.700363,98,0.82,https://www.reddit.com/r/stocks/comments/1ayrgpy/rstocks_weekend_discussion_saturday_feb_24_2024/
1aywjmp,stocks,"Can/should I buy option contracts, that have no market data?","I’m looking at NVDA DEC 18, 2026, $1,640 calls. Is it a bad idea to buy contracts like these with no market data?

 I was also wondering about ask price if I were to place $0.03 as bid price and buy 200 contracts. Would the contracts become worthless in the future as nobody is selling contracts for that price? Or will I still have the money available in my brokerage but a new ask price will be listed on that option chain?",2024-02-24 15:01:33,2024-02-29 15:30:27.700367,5 days 00:28:54.700367,21,0.61,https://www.reddit.com/r/stocks/comments/1aywjmp/canshould_i_buy_option_contracts_that_have_no/
1ay8228,stocks,"Reddit is a ‘smaller, more volatile’ Twitter, says Big Technology’s Alex Kantrowitz","Alex Kantrowitz, Big Technology founder, joins 'Squawk Box' to discuss Reddit's decision to go public, the company's journey to IPO, Sam Altman's stake in the company, and more.  
  
Highlights/humor: Squakbox host says Reddit will invite ""Reddit Army"" to IPO. Alex seems ot think Reddit's only value is ad revenue. Seems to also think it has less users than Twitter. He also tips his hat to Wallstreet Bets very hard.

https://www.cnbc.com/video/2024/02/23/reddit-is-a-smaller-more-volatile-twitter-says-big-technologys-alex-kantrowitz.html",2024-02-23 18:36:52,2024-02-29 15:30:27.700370,5 days 20:53:35.700371,52,0.91,https://www.reddit.com/r/stocks/comments/1ay8228/reddit_is_a_smaller_more_volatile_twitter_says/
1aymzb2,stocks,how should i invest my roth?,i’m 20 and banking with charles schwab for my roth ira. i have saved up $4000 in there and i want to start investing it but i don’t know how. i have option to apply for low through unlimited risk options for trading. honestly i don’t know what that means. i know low risk low reward and vice versa but i don’t know what’s best for the amount of money i have and the amount of time i have. i was thinking of investing in an S&P 500 bc i know they’re safer and see about 10% annual growth but i don’t know if that’s the right move.,2024-02-24 05:44:35,2024-02-29 15:30:27.700374,5 days 09:45:52.700374,73,0.75,https://www.reddit.com/r/stocks/comments/1aymzb2/how_should_i_invest_my_roth/
