id,subreddit,title,posttext,time_posted,time_now,time_difference,num_comments,upvote_ratio,url
1awvxw0,stocks,$BROS beat earnings estimate by 100% surpassing consensus EPS estimates four consecutive quarters in a row.,"This is the next Starbucks. The lines are ridiculous and they continue to open stores that take up minimal real estate. Their profits are phenomenal as well. 

""Dutch Bros (BROS) came out with quarterly earnings of $0.04 per share, beating the Zacks Consensus Estimate of $0.02 per share. This compares to earnings of $0.03 per share a year ago. These figures are adjusted for non-recurring items.

This quarterly report represents an earnings surprise of 100%. A quarter ago, it was expected that this drive-thru coffee chain operator and franchisor would post earnings of $0.07 per share when it actually produced earnings of $0.14, delivering a surprise of 100%.

Over the last four quarters, the company has surpassed consensus EPS estimates four times.""

https://finance.yahoo.com/news/dutch-bros-bros-q4-earnings-223003515.html",2024-02-22 03:11:23,2024-02-29 15:30:30.425011,7 days 12:19:07.425011,155,0.86,https://www.reddit.com/r/stocks/comments/1awvxw0/bros_beat_earnings_estimate_by_100_surpassing/
1ax1dl6,stocks,Is the Adobe Selloff Overblown?,"Hello,

I’m heavily considering picking up some ADBE shares possibly tomorrow or Friday after some more research on account of the sudden >10% dip in its price the past week. 

I couldn’t find any negative news, and on the contrary, found some positive articles re the introduction of AI tools to some of their products and a pretty decent interview with their CEO. Assuming it’s just an exaggerated drop due to the general volatility in tech the past week for now (direct comp like MSFT and ORCL didn’t plummet as bad however).

Financials look decent and they’ve had yoy growth in revenue and earnings the past few years. also had earnings beats the past four consecutive quarters with an estimated higher consensus eps in q1 this year.

CEO Interview w/ Cramer from today is on youtube (i can’t post yt links here)

[Article about AI tools](https://www.cnbc.com/amp/2024/02/20/adobe-launches-ai-assistant-that-can-search-and-summarize-pdfs.html)

Anyone have a strong positive/negative opinion on ADBE? ",2024-02-22 08:20:28,2024-02-29 15:30:30.425015,7 days 07:10:02.425015,118,0.84,https://www.reddit.com/r/stocks/comments/1ax1dl6/is_the_adobe_selloff_overblown/
1awp069,stocks,"Rivian slashes production outlook, announces job cuts as EV demand wanes","Rivian slashes production outlook, announces job cuts as EV demand wanes

Rivian said it sees vehicle production for 2024 hitting 57,000 units, well below the 80,000 units expected. In terms of full-year profitability, Rivian said it sees an adjusted EBITDA loss of $2.70 billion vs. $2.59 billion (est.), with capital expenditure outlays hitting $1.75 billion vs. $2.37 billion (est.). Rivian said it would cut 10% of salaried staff, citing economic uncertainty.

For the quarter, Rivian reported top-line revenue of $1.32 billion vs $1.25 billion (est.), with an adjusted loss per share of $1.36 vs. $1.33 (est.). On an adjusted EBITDA basis, Rivian reported a loss of $1.096 billion vs. $1.05 billion (est.), narrower than last year’s $1.46 billion loss.


https://finance.yahoo.com/news/rivian-earnings-153047612.html


Almost flat sales and losses are very concerning.

Also reports of 10% layoff my thoughts for Rivian employees who were affected..

",2024-02-21 22:10:40,2024-02-29 15:30:30.425019,7 days 17:19:50.425019,314,0.97,https://www.reddit.com/r/stocks/comments/1awp069/rivian_slashes_production_outlook_announces_job/
1awrxc1,stocks,Intel INTC selected as MSFT/OpenAI custom AI chip fab,"News came out at the same time as FOMC today and was lost in the shuffle a bit:

https://www.reuters.com/technology/intel-expects-overtake-tsmc-making-fastest-chips-this-year-2024-02-21/?ref=upstract.com

Article also says its process will be ahead of TSMC at the time 2025.

Notable because of Altman saying he was looking for $7T for chips, most of which will presumably go to the manufacturer (Intel).

Happy NVDA ER day!",2024-02-22 00:08:05,2024-02-29 15:30:30.425023,7 days 15:22:25.425023,117,0.8,https://www.reddit.com/r/stocks/comments/1awrxc1/intel_intc_selected_as_msftopenai_custom_ai_chip/
1awysn8,stocks,What defensive stock you own in your portfolio?,"Many people believe we are gonna have fluctuated market soon. So, what defensive stocks you own in your portfolio? Defensive stocks, in my point of view, simply means stock whose price is more stable than sp500 during market fluctuation or crash, but growth is usually similar or less than sp500. My defensive stocks includes BRK.B, TMUS, UNH, KR and MCD. Thanks for sharing your thought.",2024-02-22 05:42:29,2024-02-29 15:30:30.425026,7 days 09:48:01.425027,153,0.87,https://www.reddit.com/r/stocks/comments/1awysn8/what_defensive_stock_you_own_in_your_portfolio/
1ax3akj,stocks,"r/Stocks Daily Discussion & Options Trading Thursday - Feb 22, 2024","This is the daily discussion, so anything stocks related is fine, but the theme for today is on stock options, but if options aren't your thing then just ignore the theme.

Some helpful day to day links, including news:

* [Finviz](https://finviz.com/quote.ashx?t=spy) for charts, fundamentals, and aggregated news on individual stocks
* [Bloomberg market news](https://www.bloomberg.com/markets)
* StreetInsider news:
  * [Market Check](https://www.streetinsider.com/Market+Check) - Possibly why the market is doing what it's doing including sudden spikes/dips
  * [Reuters aggregated](https://www.streetinsider.com/Reuters) - Global news

-----

Required info to start understanding options:

* [Call option Investopedia video](https://www.investopedia.com/terms/c/calloption.asp) basically a call option allows you to buy 100 shares of a stock at a certain price (strike price), but without the obligation to buy
* [Put option Investopedia video](https://www.investopedia.com/terms/p/putoption.asp) a put option allows you to sell 100 shares of a stock at a certain price (strike price), but without the obligation to sell
* Writing options switches the obligation to you and you'll be forced to buy someone else's shares (writing puts) or sell your shares (writing calls)

See the following word cloud and click through for the wiki:

[Call option - Put option - Exercising an option - Strike price - ITM - OTM - ATM - Long options - Short options - Combo - Debit - Credit or Premium - Covered call - Naked - Debit call spread - Credit call spread - Strangle - Iron condor - Vertical debit spreads - Iron Fly](https://www.reddit.com/r/stocks/wiki/options-themed-post)

If you have a basic question, for example ""what is delta,"" then google ""investopedia delta"" and click the investopedia article on it; do this for everything until you have a more in depth question or just want to share what you learned.

See our past [daily discussions here.](https://www.reddit.com/r/stocks/search?q=author%3Aautomoderator+%22r%2Fstocks+daily+discussion%22&restrict_sr=on&sort=new&t=all)  Also links for:  [Technicals](https://www.reddit.com/r/stocks/search?q=author%3Aautomoderator+title%3Atechnicals&restrict_sr=on&include_over_18=on&sort=new&t=all) Tuesday, [Options Trading](https://www.reddit.com/r/stocks/search?q=author%3Aautomoderator+title%3Aoptions&restrict_sr=on&include_over_18=on&sort=new&t=all) Thursday, and [Fundamentals](https://www.reddit.com/r/stocks/search?q=author%3Aautomoderator+title%3Afundamentals&restrict_sr=on&include_over_18=on&sort=new&t=all) Friday.",2024-02-22 10:30:10,2024-02-29 15:30:30.425030,7 days 05:00:20.425030,589,0.84,https://www.reddit.com/r/stocks/comments/1ax3akj/rstocks_daily_discussion_options_trading_thursday/
1awk5bo,stocks,"Reddit plans to reserve shares for its big users in IPO, WSJ reports ","“Social media platform Reddit plans to sell a chunk of its IPO shares to its platform's users, the Wall Street Journal reported, opens new tab on Wednesday.


It aims to reserve an as-yet-undetermined number of shares for 75,000 of its most prolific so-called redditors when it goes public next month, the report said, citing people familiar with the matter.


The users will have the opportunity to buy Reddit shares at its initial public offering (IPO) price before the stock starts trading, a privilege normally reserved only for big investors, the report said.”




[Article](https://www.reuters.com/markets/deals/reddit-plans-reserve-shares-its-big-users-ipo-wsj-reports-2024-02-21/)",2024-02-21 18:58:37,2024-02-29 15:30:30.425034,7 days 20:31:53.425034,153,0.92,https://www.reddit.com/r/stocks/comments/1awk5bo/reddit_plans_to_reserve_shares_for_its_big_users/
1axf1er,stocks,Re-investment strategies focusing on dividends.,"I'm trying to figure out the most efficient way to Reinvest dividends.  
  
DRIP is a thing, but I was curious if not immediately reinvesting the dividend back into the Stock i received it from but instead moved it to the next stock due to pay out. (assuming record date and ex-dividend permitting). So instead of A feeding back into A, A feeds into B feeds into C that then feeds back into A.  
  
Is this a valid strategy or will it just all equal back out when it cycles back around? I feel like the varying interest rates would just cancel everything out.",2024-02-22 19:21:11,2024-02-29 15:30:30.425037,6 days 20:09:19.425038,9,0.57,https://www.reddit.com/r/stocks/comments/1axf1er/reinvestment_strategies_focusing_on_dividends/
1axe4tf,stocks,wash sale - quick question,"I believe I understand wash sales, but could use a confirmation related to the quick example below:  
  
I buy 1k shares of XYZ stock on Feb 1 2024 for $10. I buy 1k more XYZshares on Feb 15th for $9.  
  
I sell my 2k total shares of XYZ shares for an unfortunate loss on Feb 22 when XYZ is trading for $5 per share.  
  
If I buy back XYZ stock in 31 days from Feb 22, can I avoid the wash sales related to the previous buy/sells, and still claim the losses?  
  
Thanks!!!",2024-02-22 18:44:53,2024-02-29 15:30:30.425041,6 days 20:45:37.425041,10,0.58,https://www.reddit.com/r/stocks/comments/1axe4tf/wash_sale_quick_question/
1awi5s7,stocks,Is this $PANW (Palo Alto Networks) sell off a huge overreaction or am I crazy?,"I’ve owned this stock for years and am one of its biggest fans. That said, I reduced my position a few weeks ago and now only own a small amount - although this crash is making me want to add onto it. 

The best top and bottom and lowered their guidance slightly. It still looks like a profit machine and nobody can convince me that cybersecurity is going away. Am I missing something here? I feel like $270 is a steal and too good to pass up…",2024-02-21 17:40:43,2024-02-29 15:30:30.425045,7 days 21:49:47.425045,161,0.89,https://www.reddit.com/r/stocks/comments/1awi5s7/is_this_panw_palo_alto_networks_sell_off_a_huge/
1axdcog,stocks,RXST - RXSight thoughts on potential growth,New trader here but definitely enjoying the chasm of knowledge I'm falling into. Just a disclosure I've already bought 40 shares of RXST but wanted to get peoples thoughts on the company and medical stocks in general. As a myope I've definitely been considering their implantable lenses and I think the technology is quite valuable as it's reversible and applicable to a large swath of the population as more and more people become nearsighted and the ever occuring problem of cataracts. My girlfriend works in opthamology and apparently they're rolling out extended depth lenses that fix the issue certain people have where they lose their either near or far sightedness. Seems to me quite bullish considering they've also beat their earnings the past 3 quarters but most reports I find are downrating the stock or rating it as bearish.,2024-02-22 18:14:54,2024-02-29 15:30:30.425050,6 days 21:15:36.425050,3,0.7,https://www.reddit.com/r/stocks/comments/1axdcog/rxst_rxsight_thoughts_on_potential_growth/
1awkf9d,stocks,Beyond Meat BYND,"Does Beyond Meat really need to be on the NASDAQ?                                             


 I listened to the CEO talk and its new product and it dawned on me, why am I listening to this guy.  Its such a huge disconnect between their product, how they run the business internally, the supply chain end and the consumer.    
                             
Regardless if you eat meat or not it's just not good on so many levels.   I am not convinced they should be on the stock market. -93% 
                                     
Is anyone buying the product, that's actually buying the stock?  Can you make a case for even buying it in any market?   Thank You",2024-02-21 19:09:29,2024-02-29 15:30:30.425056,7 days 20:21:01.425057,267,0.73,https://www.reddit.com/r/stocks/comments/1awkf9d/beyond_meat_bynd/
1awkhon,stocks,What are Your Thoughts on Tragedy Investing?,"Idk how cynical or how ethical it is or if people get offended by it. I try to take the emotions out of it and just calculate, but I have enough social intelligence to know that others might not approve and not sure how to wrestle with it or if this is a discussion we're allowed to have.

Here's what I know.

I've made enormous amounts of money more or less just lump summing tragedies. Ex: Tel Aviv Stock Exchange. 

Are you a crisis buyer? What are the ethics of it in your view? Are we allowed to talk about this?

I can kind of justify it by almost showing solidarity with the market or something idk. ",2024-02-21 19:12:07,2024-02-29 15:30:30.425063,7 days 20:18:23.425063,65,0.76,https://www.reddit.com/r/stocks/comments/1awkhon/what_are_your_thoughts_on_tragedy_investing/
1awh47a,stocks,Can someone explain $IOVA?,"Hey yall, been a while since I’ve been into the stock game. Noticed something with $IOVA. I saw that they got FDA approval for their drug as well as their stock offering, yet it is still going up despite the offering being currently about $6 less than current stock price. 

My question is, wouldn’t the issuance of the additional 23 million shares dilute the current shares to closer to $13/share? Granted I am not naive to the fact people could still be bullish on it for the FDA approval, but is it still seriously just that strong of a market? 

Any explanation is appreciated, and if it is as simple as “because people think it’s worth more” then just disregard. 

Thank you!

*do not have position in, re-familiarizing myself before getting into any of these highly volatile stocks",2024-02-21 17:00:05,2024-02-29 15:30:30.425066,7 days 22:30:25.425067,28,0.88,https://www.reddit.com/r/stocks/comments/1awh47a/can_someone_explain_iova/
1aw6m1x,stocks,"HSBC’s record annual profit misses estimates on China write-down, shares tumble ","HSBC
’s full-year 2023 pretax profit missed analysts’ estimates on Wednesday, hit by impairment costs linked to the London-based lender’s stake in a Chinese bank, sinking its shares as much as 5%.

Europe’s largest bank by assets saw its pre-tax profit climb about 78% to a record $30.3 billion in 2023 from a year ago, according to its statement released Wednesday during the mid-day trading break in Hong Kong. That missed median estimates of $34.06 billion from analysts tracked by LSEG.

Chief Executive Noel Quinn also announced an additional share buyback of up to $2 billion to be completed ahead of the bank’s next quarterly earnings report. HSBC also said it would consider offering a special dividend of 21 cents per share in the first half of 2024 after it completes the sale of its Canada business.

With the highest full-year dividend per share since 2008 and three share buy-backs in 2023 totaling $7 billion, Quinn said the bank returned $19 billion to shareholders last year.

HSBC suffered a “valuation adjustment” of $3 billion on its 19% stake in China’s Bank of Communications, Quinn said. In an interview with CNBC following the earnings release, he said this is “a technical accounting adjustment” and “not a reflection” on BoComm.

This write-down was among the items that plunged the bank’s fourth-quarter pretax profit by 80% to $1 billion from a year earlier.

HSBC’s Hong Kong shares reversed gains of about 1% after trading resumed, falling as much as 5%. The benchmark Hang Seng Index
 was up about 2%.

Here are the other highlights of the bank’s full year 2023 financial report card:

- Revenue for 2023 increased by 30% to $66.1 billion, compared with the median LSEG forecast for about $66 billion.
- Net interest margin, a measure of lending profitability, was 1.66% — compared with 1.48% in 2022.
- Common equity tier 1 ratio — which measures the bank’s capital in relation to its assets — was 14.8%, compared with 14.2% in 2022.
- Basic earnings per share was $1.15, compared with the median LSEG forecast for $1.28 in 2023 and 75 cents for 2022.
- Dividend per ordinary share was 61 cents — the highest since 2008 — compared with 32 cents in 2022.
Outlook 2024

HSBC, which has a second home in Hong Kong, said it was focusing on the fastest growing parts of Asia, a continent where the bank makes most of its profits.

In an earnings briefing to investors and analysts, the bank said it has completed the sale of its businesses in France, Oman, Greece and New Zealand, and was in the process of exiting Russia, Canada, Mauritius and Armenia.

[https://www.cnbc.com/2024/02/21/hsbc-pre-tax-annual-profit-jumps-78percent-misses-market-estimates.html](https://www.cnbc.com/2024/02/21/hsbc-pre-tax-annual-profit-jumps-78percent-misses-market-estimates.html)",2024-02-21 07:54:23,2024-02-29 15:30:30.425070,8 days 07:36:07.425070,23,0.92,https://www.reddit.com/r/stocks/comments/1aw6m1x/hsbcs_record_annual_profit_misses_estimates_on/
1axj4og,stocks,"Nvidia- Don't Mistake a Highly Cyclical stock for Perpetual Growth. Perspective from a Software Engineer, why I set a $250 price target.","Nvidia is currently trading at over 100x earnings, but many investors will justify this by claiming that ""forward earnings"" is 25x. ""Forward earnings"" is just an estimate from analysts where they took past growth, and extrapolated it out into the future. 

These analysts do not understand the industry. They ignored AI for several years while CUDA was regularly being used in AI research and AI projects, setting price targets and earning estimates too low, and it only caught their attention as a growth engine when AI models started producing impressive media, rather than just boring scientific papers. Now, having seen earnings, they are assuming this growth will continue perpetually, without considering how the industry works.

Nvidia's growth in earnings is due to the surge in companies looking to fund AI projects. As a hot new trend, Even non-tech companies are trying to explore ways they can utilize AI, even in areas where it makes no sense and doesn't add any value. AI has essentially became a buzzword in the way that Blockchain was a few years ago, or ""internet"" was 25 years ago. Historically, these trends often last a couple years before slowing down considerably.

Since AI chips are a brand new market, companies are essentially building up AI infrastructure from nothing. And Nvidia is the only real supplier. Unlike other capital goods, there is no used/secondhand market yet. So in the short term, this has understandably meant exploding earnings as Nvidia can charge outrageous prices and faces no competition.

But will it last? It probably will in the short term, Nvidia can't ship enough chips yet to meet demand, and competitors will take time to produce viable alternatives, so there is probably a sales backlog that can keep them going a few quarters, possibly another year or two. But eventually supply will catch up to demand, and when that happens, growth will stagnate.

On top of this, a couple years down the line most companies will abandon their AI projects that don't work out.  When they do, you now have all of this used AI hardware(or cloud capacity) that is now on the market. Other companies can then buy this hardware at a discount, or cloud services now have less of a need to expand their AI compute capacity. This is exactly what happened with the crypto mining boom- Nvidia made a huge windfall from crypto mining sales, but then the market dried up, a huge oversupply hit the secondary market, and Nvidia's earnings stagnated until AI came to the rescue.

Now of course, you could argue that Nvidia will release better hardware every 2 years, and that will ensure they still have a market. And I think they will. 

But this introduces our next problem- suppliers. Nvidia is dependent on TSMC to produce their AI chips.  They could potentially use Samsung or Intel as well. They do not own their own fab.  Fortunately for them, they already had a lot of capacity they reserved with TSMC for their RTX 4000 GPUs, which they switched to produce AI chips, which has allowed them to produce a lot of AI chips for dirt cheap, and enjoy huge margins. But when Nvidia's contract with them runs out, they're at risk. Nvidia's 75% gross margin is well known. Additionally, it's almost certain that other companies like AMD are planning their own AI products. This explosion in manufacturing demand, combined with knowledge of Nvidia's high margins, will give TSMC leverage to raise their prices, threatening Nvidia's margins.

Our next issue is competitors. Nvidia may control nearly the entire  AI hardware market now, but is extremely unlikely to remain that way. AMD GPUs are just as capable of creating and running AI models as Nvidia, the main problem is most software is built for CUDA, which runs on Nvidia hardware.  

With the huge surge in the AI market, it's almost certain that there are companies out there developing AI models that can run on AMD, and it's very likely AMD is designing their own dedicated AI chips and software around it. There is tremendous amounts of money to be made in producing either cheaper hardware, or software that can run on cheaper hardware. If you look on LinkedIn, job boards, etc, you'll see semiconductor companies have hired and hiring large amounts of ML/AI engineers. And these listings don't mention CUDA. Assuming that Nvidia will never face any competition is naïve. Nvidia will probably remain a leader since they are ahead, but cheaper alternatives will threaten their pricing power.

Overall, the semiconductor industry is often a boom/bust industry, and I expect it will stay that way, even with AI. Investors should be careful buying during a boom period based on the assumption that it will continue booming.

All of this leads us to the valuation. Nvidia's quarterly earnings are likely to remain around $5 per share over the next few quarters, or possibly even grow a bit further, as demand remains high. But as competitors enter the market, a secondhand market emerges from failed startups, suppliers raise prices, and investor funding for AI startups dries up, I expect these earnings to decline over the next decade, until stabilizing when the industry matures

I ultimately decided on the following:

$25 earnings FY2025(a bit optimistic, that's assuming significant growth this year, more than analysts are predicting)

(5%) negative growth in earnings for a decade followed by 2% terminal growth rate as the industry matures and the race to the bottom ends.

8% discount rate

= $249.89 fair value per share",2024-02-22 22:01:55,2024-02-29 15:30:30.425074,6 days 17:28:35.425074,229,0.48,https://www.reddit.com/r/stocks/comments/1axj4og/nvidia_dont_mistake_a_highly_cyclical_stock_for/
1awmim3,stocks,How to consider ETF management fees?,"New to investing so lots I don’t know. 

I found an actively managed ETF (mix of tech, consumer goods, utilities) that’s a couple of years old that pays a 20.x% dividend and has a 1.5% management fee.

I know 1.5% is high for a management fee but should I care about since the dividend is so high?

Anything else to consider or questions that I should be asking before putting any money in?",2024-02-21 20:31:52,2024-02-29 15:30:30.425078,7 days 18:58:38.425078,15,0.79,https://www.reddit.com/r/stocks/comments/1awmim3/how_to_consider_etf_management_fees/
1avuya9,stocks,Amazon to replace Walgreens in Dow Industrial Average on February 26,"Amazon will replace Walgreens Boots Alliance in the Dow Jones Industrial Average, S&P Dow Jones Indices, which manages the 30-stock index, said on Tuesday. Amazon shares moved up 1% in extended trading.

The move will result in more exposure for investors who bet on the index, which is far smaller than the S&P 500.

The change goes into effect prior to market open on Feb. 26.

“Reflecting the evolving nature of the American economy, this change will increase consumer retail exposure as well as other business areas in the DJIA,” S&P Dow Jones Indices said in a statement.

The company said the revision was “prompted” by Walmart’s 3-for-1 stock split, resulting in lower index weight for Walmart.

Source: https://www.cnbc.com/2024/02/20/amazon-to-replace-walgreens-in-dow-industrial-average-on-february-26.html",2024-02-20 22:28:39,2024-02-29 15:30:30.425081,8 days 17:01:51.425081,63,0.97,https://www.reddit.com/r/stocks/comments/1avuya9/amazon_to_replace_walgreens_in_dow_industrial/
1aw20uf,stocks,Is anyone concerned about Amazon employee turnover rate?,I like Amazon as a company but the only thing stopping me from investing in Amazon is their massive employee turnover rate which is at 150% for their hourly workers. Does this concern anyone else? Are there any current owners of Amazon stock worry about the turnover rate as well or can this be something to look past? ,2024-02-21 03:39:14,2024-02-29 15:30:30.425085,8 days 11:51:16.425085,169,0.8,https://www.reddit.com/r/stocks/comments/1aw20uf/is_anyone_concerned_about_amazon_employee/
